<?xml version="1.0" encoding="UTF-8"?>
<!DOCTYPE opencms SYSTEM "http://www.alkacon.com/dtd/6.0/vfsdoctor-plugin.dtd">
<opencms>
	<vfsdoctor>
		<plugin>
			<queries>
				<query name="SELECT_ALL_STRUCTURES" >
					<default><![CDATA[
						SELECT 
							STR.STRUCTURE_ID, STR.PARENT_ID, 
							STR.RESOURCE_ID, STR.RESOURCE_PATH
						FROM 
							CMS_${PROJECT}_STRUCTURE STR 
						ORDER BY
							STR.RESOURCE_PATH
					]]></default>
				</query> 
				<query name="COPY_STRUCTURE" >
					<default><![CDATA[
						INSERT INTO 
							CMS_${PROJECT}_STRUCTURE (
								STRUCTURE_ID, RESOURCE_ID, PARENT_ID, RESOURCE_PATH, 
								STRUCTURE_STATE, DATE_EXPIRED, DATE_RELEASED)
							SELECT 
								STRUCTURE_ID, RESOURCE_ID, PARENT_ID, RESOURCE_PATH, 
								STRUCTURE_STATE, DATE_EXPIRED, DATE_RELEASED 
							FROM 
								CMS_${OTHER_PROJECT}_STRUCTURE 
							WHERE 
								STRUCTURE_ID = ?
					]]></default>
				</query> 
			</queries>
		</plugin>
	</vfsdoctor>
</opencms>
